80202,"NSLOCTEXT("""", ""F0B9BCD14F03474B990ED0B0B56B537C"", ""Table - Round"")","NSLOCTEXT("""", ""781C1C1E4AE7EF66BA8EE0AFC27B5A40"", ""A round wooden table"")","NSLOCTEXT("""", ""F369EB9F4E1774C923F34F9C2B2C7027"", ""Tables vary in shape and size, materials and decoration based on the culture and craftsmanship of their maker.\nThis one is a wooden circle.\nThe artisan was probably hoping to decorate the table with dozens of interesting objects and thereby distract from the lack of imagination in the creation of the table itself."")","/Game/UI/Textures/Icons/icon_round_table.icon_round_table","/Script/ConanSandbox.BuildingItem","/Game/Systems/Building/Placeables/BP_PL_Table_2.BP_PL_Table_2_C","/Game/Items/GatheringResources/Rock1.Rock1_C","None","100","0","BuildingItem","0.000000","0","None","OneHanded","","0","0","0","0","0.000000","0.000000","2.000000","0.000000","0.000000","0","0","0","0","0","0","0","0","0","0","0.000000","0.000000","0.000000","0.000000","0.000000","1","0.000000","0","0","0","0","Default","0","0","0","None","None","None","0","0","0","0.000000","0","-1.000000","16021","3","1","0","0","1","0","0","1","0","0","0","","","","","0","0","0.000000","1","0","None","-1"
80210,"NSLOCTEXT("""", ""9A786FAC4CE2DAECF27493B744095685"", ""Simple Palisade"")","NSLOCTEXT("""", ""5A57A0B6424C84ABA5309DAC9D943A37"", ""A bundle of sharpened stakes"")","NSLOCTEXT("""", ""5FD3BB294224263AF87FAA80D3BFF32D"", ""These makeshift bundles of sharpened wooden stakes are usually placed around mercenary camps and other temporary fortifications.\nNo sane soldier wants to charge an enemy who has ringed their camp with barricades such as these."")","/Game/UI/Textures/Icons/icon_siege_palisade_1.icon_siege_palisade_1","/Script/ConanSandbox.BuildingItem","/Game/Systems/Building/Placeables/BP_PL_SimplePalisade.BP_PL_SimplePalisade_C","/Game/Items/GatheringResources/Rock1.Rock1_C","None","100","0","BuildingItem","0.000000","0","None","OneHanded","","0","0","0","0","0.000000","0.000000","1.000000","0.000000","0.000000","0","0","0","0","0","0","0","0","0","0","0.000000","0.000000","0.000000","0.000000","0.000000","2","0.000000","0","0","0","0","Default","0","0","0","None","None","None","0","0","0","0.000000","0","-1.000000","0","0","1","0","0","1","0","0","1","0","0","0","","","","","0","0","0.000000","1","0","None","-1"
80211,"NSLOCTEXT("""", ""778DD55E47B670B8821B17B5DC76E9FB"", ""Wall Palisade"")","NSLOCTEXT("""", ""FAFA59084484450FDF4BFCA39C224307"", ""A barricade of high sharpened stakes"")","NSLOCTEXT("""", ""C35BCEB148EB324711899FBEDD6E7F72"", ""Designed as a foil to cavalry charges, the stakes on these barricades were originally about chest high to a horse. Over time it was discovered that the closer the spikes were to eye height on a horse, the less chance that the beast could be coerced into charging them."")","/Game/UI/Textures/Icons/icon_siege_palisade_2.icon_siege_palisade_2","/Script/ConanSandbox.BuildingItem","/Game/Systems/Building/Placeables/BP_PL_WallPalisade.BP_PL_WallPalisade_C","/Game/Items/GatheringResources/Rock1.Rock1_C","None","100","0","BuildingItem","0.000000","0","None","OneHanded","","0","0","0","0","0.000000","0.000000","1.000000","0.000000","0.000000","0","0","0","0","0","0","0","0","0","0","0.000000","0.000000","0.000000","0.000000","0.000000","3","0.000000","0","0","0","0","Default","0","0","0","None","None","None","0","0","0","0.000000","0","-1.000000","0","0","1","0","0","1","0","0","1","0","0","0","","","","","0","0","0.000000","1","0","None","-1"
80251,"NSLOCTEXT("""", ""0D4CD26F42B3490AEC26C98AF1F9DB75"", ""Square Stool"")","NSLOCTEXT("""", ""E84203BD432DCF13EB679F96BCC68CFC"", ""A simple wooden stool"")","NSLOCTEXT("""", ""82C0A83943D45CE14E033BA34490497D"", ""Sometimes after a day of killing and slaying, all an Exile wants to do is sit down and relax.\nStools are often used as makeshift weapons in tavern brawls across Hyboria, usually hurled at an opponent in between curses."")","/Game/UI/Textures/Icons/icon_stool_A.icon_stool_A","/Script/ConanSandbox.BuildingItem","/Game/Systems/Building/Placeables/BP_PL_Chair_Stool_Square.BP_PL_Chair_Stool_Square_C","/Game/Items/GatheringResources/Rock1.Rock1_C","None","100","0","BuildingItem","0.000000","0","None","OneHanded","","0","0","0","0","0.000000","0.000000","1.000000","0.000000","0.000000","0","0","0","0","0","0","0","0","0","0","0.000000","0.000000","0.000000","0.000000","0.000000","2","0.000000","0","0","0","0","Default","0","0","0","None","None","None","0","0","0","0.000000","0","-1.000000","16021","3","1","0","0","1","0","0","1","0","0","0","","","","","0","0","0.000000","1","0","None","-1"
80252,"NSLOCTEXT("""", ""0FF5A42F4E3C4DA4E6F05BBEAC682C33"", ""Round Stool"")","NSLOCTEXT("""", ""782465914B9CEFA1C9F5CBA2F62B346C"", ""A round wooden stool"")","NSLOCTEXT("""", ""0DC9713443D2A1BFCD04CC9BFC66FD62"", ""Useful for sitting and hurling at enemies."")","/Game/UI/Textures/Icons/icon_stool_B.icon_stool_B","/Script/ConanSandbox.BuildingItem","/Game/Systems/Building/Placeables/BP_PL_Chair_Stool_Round.BP_PL_Chair_Stool_Round_C","/Game/Items/GatheringResources/Rock1.Rock1_C","None","100","0","BuildingItem","0.000000","0","None","OneHanded","","0","0","0","0","0.000000","0.000000","1.000000","0.000000","0.000000","0","0","0","0","0","0","0","0","0","0","0.000000","0.000000","0.000000","0.000000","0.000000","2","0.000000","0","0","0","0","Default","0","0","0","None","None","None","0","0","0","0.000000","0","-1.000000","16021","3","1","0","0","1","0","0","1","0","0","0","","","","","0","0","0.000000","1","0","None","-1"
80253,"NSLOCTEXT("""", ""27DBEDEF4E9DF2C635C2EC9B9F47A215"", ""Woven Stool"")","NSLOCTEXT("""", ""12300CAF45A8BB7353A7118BC468C1CD"", ""A woven wooden stool"")","NSLOCTEXT("""", ""6BDF8FDF4718D08DFDFE099C7251750C"", ""Crafted by weaving thin bands of hard wood into a strong yet pliable surface, this stool is comfortable to sit on and very lightweight."")","/Game/UI/Textures/Icons/icon_stool_C.icon_stool_C","/Script/ConanSandbox.BuildingItem","/Game/Systems/Building/Placeables/BP_PL_Chair_Stool_Rectangular.BP_PL_Chair_Stool_Rectangular_C","/Game/Items/GatheringResources/Rock1.Rock1_C","None","100","0","BuildingItem","0.000000","0","None","OneHanded","","0","0","0","0","0.000000","0.000000","1.000000","0.000000","0.000000","0","0","0","0","0","0","0","0","0","0","0.000000","0.000000","0.000000","0.000000","0.000000","2","0.000000","0","0","0","0","Default","0","0","0","None","None","None","0","0","0","0.000000","0","-1.000000","16021","3","1","0","0","1","0","0","1","0","0","0","","","","","0","0","0.000000","1","0","None","-1"
80261,"NSLOCTEXT("""", ""23F38E2B44BAC13FE4C7CA9AF962A75D"", ""Chair"")","NSLOCTEXT("""", ""8BDDB3CE444333C8346AC7B34C41C41E"", ""A wooden chair"")","NSLOCTEXT("""", ""8705D0E541369E325F7A34908030EE9D"", ""Commonly found only in the houses of the wealthy or noble, chairs with armrests and backs are considered a mark of refinement."")","/Game/UI/Textures/Icons/icon_chair_2.icon_chair_2","/Script/ConanSandbox.BuildingItem","/Game/Systems/Building/Placeables/BP_PL_Chair_1.BP_PL_Chair_1_C","/Game/Items/GatheringResources/Rock1.Rock1_C","None","100","0","BuildingItem","0.000000","0","None","OneHanded","","0","0","0","0","0.000000","0.000000","1.000000","0.000000","0.000000","0","0","0","0","0","0","0","0","0","0","0.000000","0.000000","0.000000","0.000000","0.000000","2","0.000000","0","0","0","0","Default","0","0","0","None","None","None","0","0","0","0.000000","0","-1.000000","16021","3","1","0","0","1","0","0","1","0","0","0","","","","","0","0","0.000000","1","0","None","-1"
80271,"NSLOCTEXT("""", ""06A3FEA64719E6B41CF15994AE6C85CD"", ""Log Bench"")","NSLOCTEXT("""", ""E7A5CACC4BF5AA6BE49610A922A063F8"", ""A crude log bench"")","NSLOCTEXT("""", ""73455B9E48ACFAD35409D088DE0F5BA5"", ""Benches like this are common in the taverns and alehouses of the world. "")","/Game/UI/Textures/Icons/icon_log_bench.icon_log_bench","/Script/ConanSandbox.BuildingItem","/Game/Systems/Building/Placeables/BP_PL_LogBench.BP_PL_LogBench_C","/Game/Items/GatheringResources/Rock1.Rock1_C","None","100","0","BuildingItem","0.000000","0","None","OneHanded","","0","0","0","0","0.000000","0.000000","2.000000","0.000000","0.000000","0","0","0","0","0","0","0","0","0","0","0.000000","0.000000","0.000000","0.000000","0.000000","2","0.000000","0","0","0","0","Default","0","0","0","None","None","None","0","0","0","0.000000","0","-1.000000","16021","3","1","0","0","1","0","0","1","0","0","0","","","","","0","0","0.000000","1","0","None","-1"
80281,"NSLOCTEXT("""", ""1D03C96F4D5E6CF53794B69EDD061BFF"", ""Stone Throne"")","NSLOCTEXT("""", ""8BDB780B484FF84FCBC059B1AE9CE2FF"", ""A throne made of stone"")","NSLOCTEXT("""", ""8989374747972FF5CB78A7B53686EDEF"", ""Unlike other chairs, a throne gives the one who sits in it authority above and beyond that of an ordinary man.\nBattles have always been fought for this kind of power, and they always will be.\nSitting on a throne of any kind will increase confidence and prowess for a period."")","/Game/UI/Textures/Icons/icon_throne.icon_throne","/Script/ConanSandbox.BuildingItem","/Game/Systems/Building/Placeables/BP_PL_Chair_Throne.BP_PL_Chair_Throne_C","/Game/Items/GatheringResources/Rock1.Rock1_C","None","100","0","BuildingItem","0.000000","0","None","OneHanded","","0","0","0","0","0.000000","0.000000","10.000000","0.000000","0.000000","0","0","0","0","0","0","0","0","0","0","0.000000","0.000000","0.000000","0.000000","0.000000","3","0.000000","0","0","0","0","Default","0","0","0","None","None","None","0","0","0","0.000000","0","-1.000000","16012","68","1","16003","14","1","0","0","1","0","233","0","","","","","0","0","0.000000","1","0","None","-1"
80301,"NSLOCTEXT("""", ""82F72A524636CC33EC0DF7A8B68445EE"", ""Wooden Signpost"")","NSLOCTEXT("""", ""90757ECF4ED6ECE746BC0EB70BBDB335"", ""A wooden signpost"")","NSLOCTEXT("""", ""33AB4A95470EA349DAE6A6A155084E15"", ""In the Western kingdoms of Aquilonia and Nemedia, the practise of using wooden signs to provide warning and information for travellers and merchants has been established for centuries.\nOnce a signpost is placed, it can be used to write a custom message for any travellers to read."")","/Game/UI/Textures/Icons/icon_signpost_large.icon_signpost_large","/Script/ConanSandbox.BuildingItem","/Game/Systems/Building/Placeables/BP_PL_Signpost.BP_PL_Signpost_C","/Game/Items/GatheringResources/Rock1.Rock1_C","None","100","0","BuildingItem","0.000000","0","None","OneHanded","","0","0","0","0","0.000000","0.000000","1.000000","0.000000","0.000000","0","0","0","0","0","0","0","0","0","0","0.000000","0.000000","0.000000","0.000000","0.000000","2","0.000000","0","0","0","0","Default","0","0","0","None","None","None","0","0","0","0.000000","0","-1.000000","0","0","1","16021","1","1","0","0","1","0","0","0","","","","","0","0","0.000000","1","0","None","-1"
80302,"NSLOCTEXT("""", ""18AB20A04B2E9B2374EE27929098D031"", ""Wall Sign"")","NSLOCTEXT("""", ""2A31396C4FCD188EC1CD2791963BFFCF"", ""A wall sign"")","NSLOCTEXT("""", ""B6B662404615EAF5E32B3A9184C99926"", ""Designed to be placed on walls and provide information about the location, these signs are a mark of civilization beyond what most people would expect to find in the Exiled Lands.\nOnce a signpost is placed, it can be used to write a custom message for any travellers to read."")","/Game/UI/Textures/Icons/icon_wall_sign.icon_wall_sign","/Script/ConanSandbox.BuildingItem","/Game/Systems/Building/Placeables/BP_PL_WallSign.BP_PL_WallSign_C","/Game/Items/GatheringResources/Rock1.Rock1_C","None","100","0","BuildingItem","0.000000","0","None","OneHanded","","0","0","0","0","0.000000","0.000000","1.000000","0.000000","0.000000","0","0","0","0","0","0","0","0","0","0","0.000000","0.000000","0.000000","0.000000","0.000000","2","0.000000","0","0","0","0","Default","0","0","0","None","None","None","0","0","0","0.000000","0","-1.000000","0","0","1","16021","1","1","0","0","1","0","5","0","","","","","0","0","0.000000","1","0","None","-1"
80311,"NSLOCTEXT("""", ""34C401F74CBBF87B6A887A9AE1D06503"", ""Papyrus Scroll"")","NSLOCTEXT("""", ""65B3E4D0439A7025A1326CA93148C1D9"", ""A scroll made from flattened reed stalks"")","NSLOCTEXT("""", ""93EA354743CDD2060E2E2DAA5F80B831"", ""Made from the pith of flattened reeds, papyrus scrolls are commonly used in Stygia for holding the words of sacred texts.\nThe material used is too brittle to be very good for the creation of long-form texts, but for simple messages a papyrus scroll is cheap and easy to produce.\nThis scroll can be filled in, and then shared with others. If they can read, of course. "")","/Game/UI/Textures/Icons/icon_papyrus_scroll.icon_papyrus_scroll","/Script/ConanSandbox.BuildingItem","/Game/Systems/Building/Placeables/BP_PL_DefaultPlaceable.BP_PL_DefaultPlaceable_C","/Game/Items/GatheringResources/Rock1.Rock1_C","None","100","0","BuildingItem","0.000000","0","None","OneHanded","","0","0","0","0","0.000000","0.000000","1.000000","0.000000","0.000000","0","0","0","0","0","0","0","0","0","0","0.000000","0.000000","0.000000","0.000000","0.000000","1","0.000000","0","0","0","0","Default","0","0","0","None","None","None","0","0","0","0.000000","0","-1.000000","12001","38","1","0","0","1","0","0","1","0","5","0","","","","","0","0","0.000000","1","0","None","-1"
80501,"NSLOCTEXT("""", ""F4F3075D4C30314A7092A398946832B8"", ""Standing Torch"")","NSLOCTEXT("""", ""9C6F02754023906EA9802CB99F72E228"", ""A tall torch that can be placed in the ground"")","NSLOCTEXT("""", ""505B125D4F601415F6A708BB313A123E"", ""A large torch that can be placed in the ground to create light in an area. Some use these as beacons, to light their way home on the darkest of nights.\nIn the Exiled Lands, the torches of the Darfari Cannibals are prominent in the darkness. In their camps, the cannibals dance madly to the throbbing of skin-covered drums and their frenzy amongst the flickering light of torch and cookfire seems oddly appropriate.\nThese torches can be lit and unlit without fuel."")","/Game/UI/Textures/Icons/icon_torch_standing.icon_torch_standing","/Script/ConanSandbox.BuildingItem","/Game/Systems/Building/Placeables/BP_PL_Torch_Standing.BP_PL_Torch_Standing_C","/Game/Items/GatheringResources/Rock1.Rock1_C","None","100","0","BuildingItem","0.000000","0","None","OneHanded","","0","0","0","0","0.000000","0.000000","1.000000","0.000000","0.000000","0","0","0","0","0","0","0","0","0","0","0.000000","0.000000","0.000000","0.000000","0.000000","1","0.000000","0","0","0","0","Default","0","0","0","None","None","None","0","0","0","0.000000","0","-1.000000","0","0","1","0","0","1","0","0","1","0","0","0","","","","","0","0","0.000000","1","0","None","-1"
80503,"NSLOCTEXT("""", ""2D8B2B944AA39CFCE9C9D7AC1CE5C362"", ""Stygian Brazier"")","NSLOCTEXT("""", ""F0A29B6A4D212BC0579BAA8086B2124A"", ""An ornate brazier made in the Stygian fashion"")","NSLOCTEXT("""", ""09D7F7C843FC60CD7AB4F1AE474A317E"", ""This small brazier, made of bronze worked into the shape of a serpent, is commonly found in Stygian temples of Set. \nStygian ornamentation tends to reflect their cultural worship for the Set and his pantheon. "")","/Game/UI/Textures/Icons/icon_stygian_brazier.icon_stygian_brazier","/Script/ConanSandbox.BuildingItem","/Game/Systems/Building/Placeables/BP_PL_Brazier_Standing.BP_PL_Brazier_Standing_C","/Game/Items/GatheringResources/Rock1.Rock1_C","None","100","0","BuildingItem","0.000000","0","None","OneHanded","","0","0","0","0","0.000000","0.000000","1.000000","0.000000","0.000000","0","0","0","0","0","0","0","0","0","0","0.000000","0.000000","0.000000","0.000000","0.000000","2","0.000000","0","0","0","0","Default","0","0","0","None","None","None","0","0","0","0.000000","0","-1.000000","0","0","1","10001","38","1","10021","15","1","0","0","0","","","","","0","0","0.000000","1","0","None","-1"
80511,"NSLOCTEXT("""", ""3A3B5AC14AE33F890F3A1E9F96659B0A"", ""Bracketed Torch"")","NSLOCTEXT("""", ""D9C2C27C4BB04ABA7EF78089D19EFE2C"", ""An iron bracketed torch that can be attached to a wall"")","NSLOCTEXT("""", ""79D6C21349D8869EF19693A85FF3784C"", ""Defending a fortification during a night assault is made infinitely simpler by the ability to see where the enemy is coming from.\nAttaching torches to the walls of a building can free hands to grip a blade or pike and cast a light upon the activities of enemies."")","/Game/UI/Textures/Icons/icon_wall_torch-1.icon_wall_torch-1","/Script/ConanSandbox.BuildingItem","/Game/Systems/Building/Placeables/BP_PL_W_Torch_Gas_Wall.BP_PL_W_Torch_Gas_Wall_C","/Game/Items/GatheringResources/Rock1.Rock1_C","None","100","0","BuildingItem","0.000000","0","None","OneHanded","","0","0","0","0","0.000000","0.000000","1.000000","0.000000","0.000000","0","0","0","0","0","0","0","0","0","0","0.000000","0.000000","0.000000","0.000000","0.000000","2","0.000000","0","0","0","0","Default","0","0","0","None","None","None","0","0","0","0.000000","0","-1.000000","0","0","1","0","0","1","0","0","1","0","5","0","","","","","0","0","0.000000","1","0","None","-1"
80515,"NSLOCTEXT("""", ""7E2853934F0ADCDD55E38E9D7E1C27E1"", ""Wall Lantern"")","NSLOCTEXT("""", ""572ADE5A42D2C035A0A0D68660F1F9EC"", ""An iron-sheathed lantern that can be attached to a wall"")","NSLOCTEXT("""", ""48BCFD7B4BDED575BCED1F945E0912F6"", ""This ornate lantern bears patterning that seems to indicate that it is of Turanian origin. It is well known that the rich quarter of Agrapur has street lanterns placed at regular intervals to discourage thieves.\nLanterns have a steadier light than torches, and they remain lit for longer. However, the soft glow of a lantern fails to evoke the same primal urges as the naked flame."")","/Game/UI/Textures/Icons/icon_wall_lantern.icon_wall_lantern","/Script/ConanSandbox.BuildingItem","/Game/Systems/Building/Placeables/BP_PL_W_Lantern_Wall.BP_PL_W_Lantern_Wall_C","/Game/Items/GatheringResources/Rock1.Rock1_C","None","100","0","BuildingItem","0.000000","0","None","OneHanded","","0","0","0","0","0.000000","0.000000","1.000000","0.000000","0.000000","0","0","0","0","0","0","0","0","0","0","0.000000","0.000000","0.000000","0.000000","0.000000","3","0.000000","0","0","0","0","Default","0","0","0","None","None","None","0","0","0","0.000000","0","-1.000000","10011","30","1","41034","1","1","0","0","1","0","55","0","","","","","0","0","0.000000","1","0","None","-1"
80521,"NSLOCTEXT("""", ""B2BA54D8493DE22F85BBAD8B84937559"", ""Candle Stub"")","NSLOCTEXT("""", ""E008F7964CEEA0C51A9FE48C57FECB09"", ""The melted, half-used stub of a candle"")","NSLOCTEXT("""", ""412BCA6643D29C79A94FB88AC767DEA0"", ""Used primarily indoors, candles are the cheapest light source available. In royal castles, great candelabras with hundreds of candles light great ballrooms and throne rooms, while in the huts of peasants a single candle burns in the night to illuminate those simple tasks that are performed once the sun has dropped below the horizon.\nMade from beeswax shaped around a treated wick, this candle has been used extensively in the past."")","/Game/UI/Textures/Icons/icon_White_candle-1.icon_White_candle-1","/Script/ConanSandbox.BuildingItem","/Game/Systems/Building/Placeables/BP_PL_Candle_White.BP_PL_Candle_White_C","/Game/Items/GatheringResources/Rock1.Rock1_C","None","100","0","BuildingItem","0.000000","0","None","OneHanded","","0","0","0","0","0.000000","0.000000","0.100000","0.000000","0.000000","0","0","0","0","0","0","0","0","0","0","0.000000","0.000000","0.000000","0.000000","0.000000","1","0.000000","0","0","0","0","Default","0","0","0","None","None","None","0","0","0","0.000000","0","-1.000000","12514","4","1","0","0","1","0","0","1","0","0","0","","","","","0","0","0.000000","1","0","None","-1"
80522,"NSLOCTEXT("""", ""AA10CB304ED0F7B13B013C8A985DD131"", ""White Candle"")","NSLOCTEXT("""", ""E554DD5E4AE454E6D737A582DBCA4248"", ""A white, beeswax candle"")","NSLOCTEXT("""", ""0D0CF854441768A771DD599140262D7E"", ""Used primarily indoors, candles are the cheapest light source available. In royal castles, great candelabras with hundreds of candles light great ballrooms and throne rooms, while in the huts of peasants a single candle burns in the night to illuminate those simple tasks that are performed once the sun has dropped below the horizon.\nWhite candles are often burned in the temples of Mitra representing the purity of thought and knowledge that Mitra brings to his followers."")","/Game/UI/Textures/Icons/icon_candle_tall.icon_candle_tall","/Script/ConanSandbox.BuildingItem","/Game/Systems/Building/Placeables/BP_PL_Candle_WhiteTall.BP_PL_Candle_WhiteTall_C","/Game/Items/GatheringResources/Rock1.Rock1_C","None","100","0","BuildingItem","0.000000","0","None","OneHanded","","0","0","0","0","0.000000","0.000000","0.100000","0.000000","0.000000","0","0","0","0","0","0","0","0","0","0","0.000000","0.000000","0.000000","0.000000","0.000000","1","0.000000","0","0","0","0","Default","0","0","0","None","None","None","0","0","0","0.000000","0","-1.000000","12514","4","1","0","0","1","0","0","1","0","0","0","","","","","0","0","0.000000","1","0","None","-1"
80523,"NSLOCTEXT("""", ""697F37984BB017731BD744B25F0B7AA6"", ""Black Candle"")","NSLOCTEXT("""", ""7A5336E64CB2E5090735049F679EC8E4"", ""A black, beeswax candle"")","NSLOCTEXT("""", ""49ACC1C04AA0CDF87AA9F28D65EAEA30"", ""Used primarily indoors, candles are the cheapest light source available. In royal castles, great candelabras with hundreds of candles light great ballrooms and throne rooms, while in the huts of peasants a single candle burns in the night to illuminate those simple tasks that are performed once the sun has dropped below the horizon.\nBlack candles are sought after by sorcerers for use in their rituals. The vilest of men purportedly create candles from the blood of demons for communicating with presences that circle in the Outer Void."")","/Game/UI/Textures/Icons/icon_black_candle-1.icon_black_candle-1","/Script/ConanSandbox.BuildingItem","/Game/Systems/Building/Placeables/BP_PL_Candle_Black.BP_PL_Candle_Black_C","/Game/Items/GatheringResources/Rock1.Rock1_C","None","100","0","BuildingItem","0.000000","0","None","OneHanded","","0","0","0","0","0.000000","0.000000","0.100000","0.000000","0.000000","0","0","0","0","0","0","0","0","0","0","0.000000","0.000000","0.000000","0.000000","0.000000","1","0.000000","0","0","0","0","Default","0","0","0","None","None","None","0","0","0","0.000000","0","-1.000000","12514","4","1","0","0","1","0","0","1","0","0","0","","","","","0","0","0.000000","1","0","None","-1"
80531,"NSLOCTEXT("""", ""282B2FBC426FDB29DA01649A43F75B9D"", ""Radium Gem"")","NSLOCTEXT("""", ""63E74FF7455556CD4A3D99B39340CD48"", ""An odd gem that glows when rubbed"")","NSLOCTEXT("""", ""A91ED09E408AC2A99901328C09166A13"", ""<span style=\""italic\"">\'They are jewels, fused with radium. You rub them with your thumb to make them glow, and rub them again, the opposite way, to extinguish them.\'</>\nXuthal of the Dusk\nThe product of a science long vanished in the ancient past, these gems seem to glow indefinitely when activated. There is a cost, however, as those who use the Radium Gems seem to slowly lose their grip on sanity, whispering to themselves of green stoned cities and the nameless horrors that stalk them."")","/Game/UI/Textures/Icons/icon_radium_gem.icon_radium_gem","/Script/ConanSandbox.BuildingItem","/Game/Systems/Building/Placeables/BP_PL_DefaultPlaceable.BP_PL_DefaultPlaceable_C","/Game/Items/GatheringResources/Rock1.Rock1_C","None","100","0","BuildingItem","0.000000","0","None","OneHanded","","0","0","0","0","0.000000","0.000000","1.000000","0.000000","0.000000","0","0","0","0","0","0","0","0","0","0","0.000000","0.000000","0.000000","0.000000","0.000000","4","0.000000","0","0","0","0","Default","0","0","0","None","None","None","0","0","0","0.000000","0","-1.000000","10001","38","1","14171","23","1","0","0","1","0","0","0","","","","","0","0","0.000000","5","0","None","-1"
80551,"NSLOCTEXT("""", ""E1CAAF6F4FEF6BB98FC39B88A9447A23"", ""Tapestry"")","NSLOCTEXT("""", ""EF2C803C4E2E3CE06A274D8B99986BBA"", ""A patterned tapestry in earthen colors"")","NSLOCTEXT("""", ""B796A6794FB0D8CF43F409B0C2EA5DC3"", ""Tapestries such as this travel the Lotus road between Khitai and the Kingdoms of the West daily. Woven of plant fibers or silk, they vary in quality and quantity based entirely on the skill of the weaver and the materials used. \nThat these can be made in the Exiled Lands, without a loom, is impressive."")","/Game/UI/Textures/Icons/icon_orange_tapestry.icon_orange_tapestry","/Script/ConanSandbox.BuildingItem","/Game/Systems/Building/Placeables/BP_PL_W_Tapestry_1.BP_PL_W_Tapestry_1_C","/Game/Items/GatheringResources/Rock1.Rock1_C","None","100","0","BuildingItem","0.000000","0","None","OneHanded","","0","0","0","0","0.000000","0.000000","10.000000","0.000000","0.000000","0","0","0","0","0","0","0","0","0","0","0.000000","0.000000","0.000000","0.000000","0.000000","2","0.000000","0","0","0","0","Default","0","0","0","None","None","None","0","0","0","0.000000","0","-1.000000","12511","19","1","0","0","1","0","0","1","0","5","0","","","","","0","0","0.000000","1","0","None","-1"
