51817,"NSLOCTEXT("""", ""CA7F9D364BFA61528D232B9D20787B7C"", ""Serpent-stamped Khopesh"")","NSLOCTEXT("""", ""AC4306544DE283FA713E899373C4784D"", ""A Khopesh stamped with the symbol of the serpent"")","NSLOCTEXT("""", ""025471AF46404544C6D74BBE2D33A5BF"", ""<span style=\""italic\"">The common men of Stygia were not allowed to wear swords, and the mantle was not voluminous enough to hide the Cimmerian\'s long blade, but Conan buckled to his hip a Ghanta knife, a weapon borne by the fierce desert men who dwelt to the south of the Stygians, a broad, heavy, slightly curved blade of fine steel, edged like a razor and long enough to dismember a man.</> - The Hour of the Dragon\nIt is forbidden in the kingdom of Stygia for the common man to bear a sword, but the khopesh, particularly one that has taken part in the bloody rituals of Set, is allowed.\nThis khopesh appears to be made of steel, yet it is tinted the bronze color that Stygian ceremonial garb requires. The symbol engraved on the blade is the symbol of Set, the sacred serpent. Blades such as these are passed among the priesthood and given to those who show particular fervor when participating in the rites of blood."")","/Game/UI/Textures/Icons/icon_khopesh-1.icon_khopesh-1","/Game/Items/BPGameItemWeapon.BPGameItemWeapon_C","None","/Game/Items/Weapons/Sword1h/sword1h.sword1h_C","None","1","1","Weapon","0.000000","9","Sword","OneHanded","","2","3","0","0","0.000000","1.000000","2.100000","35.000000","250.000000","125","156","0","0","0","0","0","0","1","33","180.000000","1.000000","0.000000","0.000000","0.000000","2","0.135000","0","0","0","0","Steel","30","60","0","/Game/Items/Weapons/Sword1h/SM_1h_stygia_sword_ornamented_iron_god.SM_1h_stygia_sword_ornamented_iron_god","None","/Game/Items/Weapons/Sword1h/SM_1h_stygia_sword_ornamented_iron_god_DM.SM_1h_stygia_sword_ornamented_iron_god_DM","0","0","0","0.000000","0","420.000000","0","0","1","11501","15","1","15001","38","1","0","0","0","NSLOCTEXT("""", ""FCCF5FBE423581B3F2C6E6BDF13CDE99"", ""Hallowed"")","NSLOCTEXT("""", ""26E8406940FEDAF1D38D888A94522135"", ""Weapon"")","","","0","0","0.000000","1","0","None","-1"
51818,"NSLOCTEXT("""", ""F73DEEA54F5C1DB69B170285B4C4BE93"", ""Exceptional Stygian Khopesh"")","NSLOCTEXT("""", ""E828316546705BED337D2DA74E9EB9AA"", ""A sickle-sword used by the Stygian nobility"")","NSLOCTEXT("""", ""8AED952A49C46654C7AEBF96874A78A3"", ""<span style=\""italic\""> It was prince Kutamun, naked but for a loin-cloth, his harness hacked away, his crested helmet dented, his limbs splashed with blood. With a terrible shout he hurled his broken hilt full into Conan\'s face, and leaping, seized the stallion\'s bridle.</>\nBlack Collossus\n\nThe favoured weapon of Stygian royalty, the khopesh is traditionally cast in bronze and hilted in pure ivory. With the development of stronger metals, the Stygian smiths began using iron and steel during their creation, and diluting out the bronze cast which made them pleasing to the nobility. \nInterestingly, this weapon has more in common with an axe than a sword and is best used for hacking and chopping rather than slicing and dicing."")","/Game/UI/Textures/Icons/icon_khopesh-1.icon_khopesh-1","/Game/Items/BPGameItemWeapon.BPGameItemWeapon_C","None","/Game/Items/Weapons/Sword1h/sword1h.sword1h_C","None","1","1","Weapon","0.000000","9","Sword","OneHanded","","2","3","0","0","0.000000","1.000000","1.750000","35.000000","250.000000","61","77","0","0","0","0","0","0","1","33","180.000000","1.000000","0.000000","0.000000","0.000000","3","0.135000","0","0","0","0","Iron","30","60","0","/Game/Items/Weapons/Sword1h/SM_1h_stygia_sword_ornamented_iron.SM_1h_stygia_sword_ornamented_iron","None","/Game/Items/Weapons/Sword1h/SM_1h_stygia_sword_ornamented_iron_DM.SM_1h_stygia_sword_ornamented_iron_DM","0","0","0","0.000000","0","205.000000","0","0","1","11501","15","1","0","0","1","0","0","0","NSLOCTEXT("""", ""74EDE586432D60825C71E8A728F9C759"", ""Mid Grade"")","NSLOCTEXT("""", ""275762EB4CC3C6C080E10C9372D9E060"", ""Weapon"")","NSLOCTEXT("""", ""475DC81E491FDAB17EE1FFAA75AB46A7"", ""Exceptional"")","","0","0","0.000000","1","0","None","-1"
51821,"NSLOCTEXT("""", ""0403F8AA459575A488D76DACE0C319EB"", ""Falcata"")","NSLOCTEXT("""", ""EF9C004448AD298CCC42A9BDFB67B854"", ""A curved sword with a single sharp edge"")","NSLOCTEXT("""", ""D0E40D19446B2724EC2D9BB7B6DE7426"", ""<span style=\""italic\""> A man on a giant horse whirled, slashed and smote apparently at thin air, and from another direction swept a wild horde of riders, their curved swords flashing in the moonlight.</>\nDrums in Tombalku\n\nStraddling the line between the traditional khopesh of Stygia and broadsword favoured in the northern kingdoms, the falcata is forward curved blade with a single edge on the concave side.\nThe distinctive hooked hilt helps to prevent the weapon from jarring free of the hands during battle.\nThere is much dispute about the origin of the weapon, considering its similarity to the Argossean kopis and the Stygian khopesh. \nThis falcata bears no marking which would betray its origin."")","/Game/UI/Textures/Icons/icon_falcata.icon_falcata","/Game/Items/BPGameItemWeapon.BPGameItemWeapon_C","None","/Game/Items/Weapons/Sword1h/sword1h.sword1h_C","None","1","1","Weapon","0.000000","9","Sword","OneHanded","","2","3","0","0","0.000000","1.000000","1.750000","35.000000","250.000000","94","118","0","0","0","0","0","0","1","33","180.000000","1.000000","0.000000","0.000000","0.000000","2","0.135000","0","0","0","0","Iron","30","60","0","/Game/Items/Weapons/Sword1h/SM_1h_edge_stygia_sword_falcata_ornamented_steel.SM_1h_edge_stygia_sword_falcata_ornamented_steel","None","/Game/Items/Weapons/Sword1h/SM_1h_edge_stygia_sword_falcata_ornamented_steel_DM.SM_1h_edge_stygia_sword_falcata_ornamented_steel_DM","0","0","0","0.000000","0","315.000000","0","0","1","11501","15","1","0","0","1","0","0","0","NSLOCTEXT("""", ""B9BDE58D48CC5289682A3A93285EF7F5"", ""High Grade"")","NSLOCTEXT("""", ""BD5C7EB64B2133561B11BE85B8E6F140"", ""Weapon"")","","","0","0","0.000000","1","0","None","-1"
51822,"NSLOCTEXT("""", ""943106DD487CED7FDD290EB69539C665"", ""Cutlass"")","NSLOCTEXT("""", ""79B80F10448BFCB2D41ABAA0F92B907D"", ""A slashing weapon favoured by pirates"")","NSLOCTEXT("""", ""FAE0A80143C1BBB9237844BE10043AEE"", ""<span style=\""italic\""> At this kind of fighting the freebooters of the sea were at their stoutest; their arrows and bolts tore holes in the charging horde, their cutlasses hewed the wild men from the palisades they strove to scale.</>\nThe Black Stranger\n\nFavoured by sailors from the Western ocean to the Vilayet, the cutlass is a short, curved sword capable of hacking through ropes, canvas, wood, and flesh.\nForged of cheap iron, cutlasses are usually splotched with rust due to their time spent near salt water. \nThis cutlass does not bear any markers of origin."")","/Game/UI/Textures/Icons/icon_cutlass.icon_cutlass","/Game/Items/BPGameItemWeapon.BPGameItemWeapon_C","None","/Game/Items/Weapons/Sword1h/sword1h.sword1h_C","None","1","1","Weapon","0.000000","9","Sword","OneHanded","","2","3","0","0","0.000000","1.000000","2.420000","35.000000","250.000000","77","97","0","0","0","0","0","0","1","33","180.000000","1.000000","0.000000","0.000000","0.000000","3","0.120000","0","0","0","0","Iron","30","60","0","/Game/Items/Weapons/Sword1h/SM_1h_edge_sword_cutlass_steel.SM_1h_edge_sword_cutlass_steel","None","/Game/Items/Weapons/Sword1h/SM_1h_edge_sword_cutlass_steel_DM.SM_1h_edge_sword_cutlass_steel_DM","0","0","0","0.000000","0","220.000000","0","0","1","11501","15","1","0","0","1","0","0","0","NSLOCTEXT("""", ""F8C5A53049C6C3C38DF709A69112EB0C"", ""Mid Grade"")","NSLOCTEXT("""", ""D02D36AE49E5184340E5BC8E2215B347"", ""Weapon"")","","","0","0","0.000000","1","0","None","-1"
51823,"NSLOCTEXT("""", ""87627AD146D38741FCC93189DA28CC2A"", ""Exceptional Cutlass"")","NSLOCTEXT("""", ""AC3509F045F7B6427C8FC3B2AD032643"", ""A slashing weapon favoured by pirates"")","NSLOCTEXT("""", ""A2B0CDBD434AB7DA5FD508A483D35117"", ""<span style=\""italic\""> At this kind of fighting the freebooters of the sea were at their stoutest; their arrows and bolts tore holes in the charging horde, their cutlasses hewed the wild men from the palisades they strove to scale.</>\nThe Black Stranger\n\nFavoured by sailors from the Western ocean to the Vilayet, the cutlass is a short, curved sword capable of hacking through ropes, canvas, wood, and flesh.\nForged of cheap iron, cutlasses are usually splotched with rust due to their time spent near salt water. \nThis cutlass does not bear any markers of origin."")","/Game/UI/Textures/Icons/icon_cutlass.icon_cutlass","/Game/Items/BPGameItemWeapon.BPGameItemWeapon_C","None","/Game/Items/Weapons/Sword1h/sword1h.sword1h_C","None","1","1","Weapon","0.000000","9","Sword","OneHanded","","2","3","0","0","0.000000","1.000000","2.100000","35.000000","250.000000","79","99","0","0","0","0","0","0","1","33","180.000000","1.000000","0.000000","0.000000","0.000000","3","0.120000","0","0","0","0","Iron","30","60","0","/Game/Items/Weapons/Sword1h/SM_1h_edge_sword_cutlass_steel.SM_1h_edge_sword_cutlass_steel","None","/Game/Items/Weapons/Sword1h/SM_1h_edge_sword_cutlass_steel_DM.SM_1h_edge_sword_cutlass_steel_DM","0","0","0","0.000000","0","255.000000","0","0","1","11501","15","1","0","0","1","0","0","0","NSLOCTEXT("""", ""2856BB3441B23FDB317FC5B1979C0C27"", ""Mid Grade"")","NSLOCTEXT("""", ""1D62377B46C19374F289F38A06F7129B"", ""Weapon"")","NSLOCTEXT("""", ""4D0CEE1E404EE5E314702E9F50A075F8"", ""Exceptional"")","","0","0","0.000000","1","0","None","-1"
51831,"NSLOCTEXT("""", ""152F97E845305FB0C9DBC48907CAAA24"", ""Longsword"")","NSLOCTEXT("""", ""0E7CF4B046187F3FBC91EA9A7D7FA36B"", ""A common, thin bladed, double-edged sword"")","NSLOCTEXT("""", ""0DA96A05442A6D7A0A7BADB9EB0F6905"", ""<span style=\""italic\""> They stopped short. Conan faced them, not a naked man roused mazed and unarmed out of deep sleep to be butchered like a sheep, but a barbarian wide-awake and at bay, partly armored, and with his long sword in his hand.</>\nThe Phoenix on the Sword\n\nLongsword has become a catch-all phrase for the mongrel swords of a thousand different makes that don?t align easily with one simple classification.\nThe only description of a longsword that seems to be agreed upon is that they are double-bladed and straight. Beyond that they vary wildly from grooved blades to smooth blades, long hilts to short hilts, one-handed and two-handed variations.\nThis example is plain, straight and intended to be wielded in a single hand."")","/Game/UI/Textures/Icons/icon_longsword.icon_longsword","/Game/Items/BPGameItemWeapon.BPGameItemWeapon_C","None","/Game/Items/Weapons/Sword1h/sword1h.sword1h_C","None","1","1","Weapon","0.000000","9","Sword","OneHanded","","2","3","0","0","0.000000","1.000000","1.750000","35.000000","250.000000","92","115","0","0","0","0","0","0","1","33","180.000000","1.000000","0.000000","0.000000","0.000000","3","0.135000","0","0","0","0","Steel","30","60","0","/Game/Items/Weapons/Sword1h/SM_1h_exile_longsword.SM_1h_exile_longsword","None","/Game/Items/Weapons/Sword1h/SM_1h_exile_longsword_DM.SM_1h_exile_longsword_DM","0","0","0","0.000000","0","350.000000","0","0","1","11502","15","1","0","0","1","0","0","0","NSLOCTEXT("""", ""F097158B4CE0ED5719A8EC89CB2BB829"", ""High Grade"")","NSLOCTEXT("""", ""72A1B8CF461374DCCEDACC8616A73712"", ""Weapon"")","","","0","0","0.000000","1","0","None","-1"
51832,"NSLOCTEXT("""", ""4ACD244846A781C9D8846EAECF5924A2"", ""Dry Scraper"")","NSLOCTEXT("""", ""61C576934C18D84A51839DB09666F8A6"", ""A razor sharp tool for scraping hides"")","NSLOCTEXT("""", ""A2E85AF0434F0837195257BD53F9C69B"", ""<span style=\""italic\"">But a bat has flown over the Mountains of the Dead and drawn your image in blood on the white tiger\'s hide that hangs before the long hut where sleep the Four Brothers of the Night.</> - Beyond the Black River\n\nBefore preparation, hides must be scraped to remove excess fibres and clots of skin. The best hide scrapers are sharp, easy to weild and leave a smooth line of transition so that it is easy to see which part of the hide still requires treatment."")","/Game/UI/Textures/Icons/icon_thrall_scrape.icon_thrall_scrape","/Game/Items/BPGameItemWeapon.BPGameItemWeapon_C","None","/Game/Items/Weapons/Sword1h/sword1h.sword1h_C","None","1","1","Weapon","0.000000","9","Sword","OneHanded","","1","0","0","0","0.000000","1.000000","2.010000","35.000000","250.000000","10","12","0","0","0","0","0","0","1","33","180.000000","1.000000","0.000000","0.000000","0.000000","1","0.000000","0","0","0","0","Stone","30","60","0","/Game/Items/Weapons/Thralls/Thrall_scrape/SM_1h_thrall_scrape_01.SM_1h_thrall_scrape_01","None","/Game/Items/Weapons/Thralls/Thrall_scrape/SM_1h_thrall_scrape_01_DM.SM_1h_thrall_scrape_01_DM","0","0","0","0.000000","0","200.000000","0","0","1","11501","15","1","0","0","1","0","0","0","NSLOCTEXT("""", ""EA64C8E5436D156E53F890ADA4511D41"", ""Low Grade"")","NSLOCTEXT("""", ""35A96E9142D76D271C73D98E55CC5CAE"", ""Weapon"")","","","0","0","0.000000","1","0","None","-1"
51833,"NSLOCTEXT("""", ""AEE5E3E94AF3243F8FA68EBA428ADD74"", ""Darfari Axe"")","","","/Game/UI/Textures/Icons/icon_yog_cleaver.icon_yog_cleaver","/Game/Items/BPGameItemWeapon.BPGameItemWeapon_C","None","/Game/Items/Weapons/Axe/BP_Axe.BP_Axe_C","None","1","1","Weapon","0.000000","9","Axe","OneHanded","","2","2","0","0","0.000000","1.000000","2.350000","35.000000","250.000000","34","42","0","0","0","0","0","0","1","33","180.000000","1.000000","0.000000","0.000000","0.000000","1","0.040000","0","0","0","0","Stone","30","60","0","/Game/Items/Weapons/Axe/SM_1h_axe_yog.SM_1h_axe_yog","None","/Game/Items/Weapons/Axe/SM_1h_axe_yog_DM.SM_1h_axe_yog_DM","0","0","0","0.000000","0","50.000000","0","0","1","10001","15","1","0","0","1","0","0","0","NSLOCTEXT("""", ""E13CA0D14E82C2E655D6D4AB34E32B10"", ""Low Grade"")","NSLOCTEXT("""", ""59B6B7FB47F24D6256246B8A17C31C22"", ""Weapon"")","","","0","0","0.000000","1","0","None","-1"
51834,"NSLOCTEXT("""", ""8A9C97C14AA20C730CA14DA80D1450B2"", ""El\'s Drinker"")","NSLOCTEXT("""", ""00E29C5E475A744B1629D89AC652A56E"", ""A sword of blackest ebony"")","NSLOCTEXT("""", ""F9914BB54804517F89D03093FBBDF18E"", ""The origins of this blade are mysteriously absent from any record. Those who have possessed it over the years claim that it fills them with a nameless hunger for blood.\nOnce the sword was taken to oracle who named it a dark spirit that \""crosses between worlds and time endlessly, in search of shattered men in shattered lands who will let it drink\""."")","/Game/UI/Textures/Icons/icon_longsword.icon_longsword","/Game/Items/BPGameItemWeapon.BPGameItemWeapon_C","None","/Game/Items/Weapons/Sword1h/sword1h.sword1h_C","None","1","1","Weapon","0.000000","9","Sword","OneHanded","","2","3","0","0","0.000000","1.000000","1.400000","35.000000","250.000000","114","142","0","0","0","0","0","0","1","33","180.000000","1.000000","0.000000","0.000000","0.000000","3","0.135000","0","0","0","0","Iron","30","60","0","/Game/Items/Weapons/Sword1h/SM_1h_exile_longsword.SM_1h_exile_longsword","None","/Game/Items/Weapons/Sword1h/SM_1h_exile_longsword_DM.SM_1h_exile_longsword_DM","0","0","0","0.000000","0","410.000000","0","0","1","0","0","1","0","0","1","0","0","0","NSLOCTEXT("""", ""74F54CED4AFDC47CB209629D20D4E29D"", ""High Grade"")","NSLOCTEXT("""", ""2A62BDAD495B1CAC5B3B4CB0509280FD"", ""Weapon"")","","","0","0","0.000000","1","0","None","-1"
51835,"NSLOCTEXT("""", ""45F3EAB64B682343FDBB169F043084AB"", ""Tulwar of Amir Khurum"")","NSLOCTEXT("""", ""B4FE102A4DF38FE278CF259F3292B5D3"", ""Legendary tulwar of a Wazuli Chief"")","NSLOCTEXT("""", ""1542B4244C047025A0CBF58166821689"", ""<span style=\""italic\""> Conan lifted his knife and smote, and the watchers were dumbfounded to see his blow checked apparently in midair, with the loud clang of steel that meets an unyielding substance. He wasted no more effort. He knew that not even the legendary tulwar of Amir Khurum could shatter that invisible curtain.</>\nThe People of the Black Circle\n\nAmir Khurum was a legendary prince and commander of the Wazuli tribe. The Wazuli revere his memory for his even-handed nature as a chief - he dealt honorably with all and led them to a great deal of treasure in his career.\nIf the legends are to be believer, this tulwar can pass through any armor, though it is hard to say if this is the original item or an elaborate forgery."")","/Game/UI/Textures/Icons/icon_longsword.icon_longsword","/Game/Items/BPGameItemWeapon.BPGameItemWeapon_C","None","/Game/Items/Weapons/Sword1h/sword1h.sword1h_C","None","1","1","Weapon","0.000000","9","Sword","OneHanded","","2","3","0","0","0.000000","1.000000","1.400000","35.000000","250.000000","114","142","0","0","0","0","0","0","1","33","180.000000","1.000000","0.000000","0.000000","0.000000","3","0.135000","0","0","0","0","Iron","30","60","0","/Game/Items/Weapons/Sword1h/SM_1h_edge_sword_cutlass_steel.SM_1h_edge_sword_cutlass_steel","None","/Game/Items/Weapons/Sword1h/SM_1h_edge_sword_cutlass_steel_DM.SM_1h_edge_sword_cutlass_steel_DM","0","0","0","0.000000","0","410.000000","0","0","1","0","0","1","0","0","1","0","0","0","NSLOCTEXT("""", ""179466F1462CE1FF22B63BA60588D4FE"", ""High Grade"")","NSLOCTEXT("""", ""99EE181947C3AD20965050A6303A5D2B"", ""Weapon"")","","","0","0","0.000000","1","0","None","-1"
51836,"NSLOCTEXT("""", ""40B9119343445D9EF2EECD9B54A81925"", ""Exceptional Longsword"")","NSLOCTEXT("""", ""930D0E334325B3DE62B3C9929C94BD48"", ""A common, thin bladed, double-edged sword"")","NSLOCTEXT("""", ""0A1EEA49450965E95AEE239F9663BF8F"", ""<span style=\""italic\""> They stopped short. Conan faced them, not a naked man roused mazed and unarmed out of deep sleep to be butchered like a sheep, but a barbarian wide-awake and at bay, partly armored, and with his long sword in his hand.</>\nThe Phoenix on the Sword\n\nLongsword has become a catch-all phrase for the mongrel swords of a thousand different makes that don?t align easily with one simple classification.\nThe only description of a longsword that seems to be agreed upon is that they are double-bladed and straight. Beyond that they vary wildly from grooved blades to smooth blades, long hilts to short hilts, one-handed and two-handed variations.\nThis example is plain, straight and intended to be wielded in a single hand."")","/Game/UI/Textures/Icons/icon_longsword.icon_longsword","/Game/Items/BPGameItemWeapon.BPGameItemWeapon_C","None","/Game/Items/Weapons/Sword1h/sword1h.sword1h_C","None","1","1","Weapon","0.000000","9","Sword","OneHanded","","2","3","0","0","0.000000","1.000000","1.580000","35.000000","250.000000","94","117","0","0","0","0","0","0","1","33","180.000000","1.000000","0.000000","0.000000","0.000000","3","0.135000","0","0","0","0","Steel","30","60","0","/Game/Items/Weapons/Sword1h/SM_1h_exile_longsword.SM_1h_exile_longsword","None","/Game/Items/Weapons/Sword1h/SM_1h_exile_longsword_DM.SM_1h_exile_longsword_DM","0","0","0","0.000000","0","380.000000","0","0","1","11502","15","1","0","0","1","0","0","0","NSLOCTEXT("""", ""D0CBD24F47F4F1B51B9DA49426C27FE0"", ""High Grade"")","NSLOCTEXT("""", ""CDBBF03C42E637183A385EBBB67F57D1"", ""Weapon"")","NSLOCTEXT("""", ""EFC9C6024571064C48A77F88665F38EC"", ""Exceptional"")","","0","0","0.000000","1","0","None","-1"
51837,"NSLOCTEXT("""", ""AA38568942B2340982A96DBFA8FDC65C"", ""Flawless Longsword"")","NSLOCTEXT("""", ""69A3E16D4943A1FC8A584B91256EE34A"", ""A common, thin bladed, double-edged sword"")","NSLOCTEXT("""", ""A244006D45E6FBA1AC2F3C898FEF8ACC"", ""<span style=\""italic\""> They stopped short. Conan faced them, not a naked man roused mazed and unarmed out of deep sleep to be butchered like a sheep, but a barbarian wide-awake and at bay, partly armored, and with his long sword in his hand.</>\nThe Phoenix on the Sword\n\nLongsword has become a catch-all phrase for the mongrel swords of a thousand different makes that don?t align easily with one simple classification.\nThe only description of a longsword that seems to be agreed upon is that they are double-bladed and straight. Beyond that they vary wildly from grooved blades to smooth blades, long hilts to short hilts, one-handed and two-handed variations.\nThis example is plain, straight and intended to be wielded in a single hand."")","/Game/UI/Textures/Icons/icon_longsword.icon_longsword","/Game/Items/BPGameItemWeapon.BPGameItemWeapon_C","None","/Game/Items/Weapons/Sword1h/sword1h.sword1h_C","None","1","1","Weapon","0.000000","9","Sword","OneHanded","","2","3","0","0","0.000000","1.000000","1.400000","35.000000","250.000000","96","120","0","0","0","0","0","0","1","33","180.000000","1.000000","0.000000","0.000000","0.000000","3","0.135000","0","0","0","0","Steel","30","60","0","/Game/Items/Weapons/Sword1h/SM_1h_exile_longsword.SM_1h_exile_longsword","None","/Game/Items/Weapons/Sword1h/SM_1h_exile_longsword_DM.SM_1h_exile_longsword_DM","0","0","0","0.000000","0","410.000000","0","0","1","11502","15","1","0","0","1","0","0","0","NSLOCTEXT("""", ""03DCEB034233309549EE83B274F45209"", ""High Grade"")","NSLOCTEXT("""", ""EEA448384D7CCD0395F02BA8D34D156B"", ""Weapon"")","NSLOCTEXT("""", ""F8007DD842AE22C944CC5CB85F277C79"", ""Flawless"")","","0","0","0.000000","1","0","None","-1"
51850,"NSLOCTEXT("""", ""54F9394C45210AE5CD7D399C007BF794"", ""Darfari Cudgel"")","","","/Game/UI/Textures/Icons/icon_darfari_bone_club.icon_darfari_bone_club","/Game/Items/BPGameItemWeapon.BPGameItemWeapon_C","None","/Game/Items/Weapons/Club/BP_club_1h.BP_club_1h_C","None","1","1","Weapon","0.000000","9","Axe","OneHanded","","2","2","0","0","0.000000","1.000000","2.660000","35.000000","250.000000","27","34","0","0","0","0","0","0","1","33","180.000000","1.000000","0.000000","0.000000","0.000000","1","0.320000","0","0","0","0","Stone","30","60","0","/Game/Items/Weapons/Club/SM_Club_yog.SM_Club_yog","None","/Game/Items/Weapons/Club/SM_Club_yog_DM.SM_Club_yog_DM","0","0","0","0.000000","0","50.000000","0","0","1","10001","30","1","0","0","1","0","0","0","NSLOCTEXT("""", ""FBDE82D4433F2FDEFA38B9866DE34F44"", ""Low Grade"")","NSLOCTEXT("""", ""E4E1239A43F7DD1C30AE18BB49D225D7"", ""Weapon"")","","","0","0","0.000000","1","0","None","-1"
51851,"NSLOCTEXT("""", ""E1ADD02041D1C3677AFB68A2BCCCC958"", ""Cimmerian Battle-axe"")","NSLOCTEXT("""", ""127CE456439B37D7B339449DFB6AA77A"", ""A vicious, double bladed steel axe"")","NSLOCTEXT("""", ""C3897B7D4C5E7DFAC64E48B6FF5E6A56"", ""<span style=\""italic\""> He did not wonder at the strangeness of it all, not even when two gigantic figures rose up to bar his way. The scales of their mail were white with hoar-frost; their helmets and their axes were covered with ice.</>\nThe Frost Giant?s Daughter\n\nShaped of steel and marked with the swirling markings of a Cimmerian clan, this battle-axe is sharp, durable and capable of inflicting vicious wounds.\nBattle-axes are a difficult weapon for inexperienced warriors, due to their smaller surface area and uneven balance. No other one-handed weapon shares their raw power, however, and they can wreak havoc on unarmored foes.\nCimmerian clans often engage in violent local conflict and the battle-axe is a preferred weapon for breaching the wood-walled settlements and laying waste to the rival clansmen within.\n"")","/Game/UI/Textures/Icons/icon_cimmerian_battleaxe.icon_cimmerian_battleaxe","/Game/Items/BPGameItemWeapon.BPGameItemWeapon_C","None","/Game/Items/Weapons/Sword1h/sword1h.sword1h_C","None","1","1","Weapon","0.000000","9","Axe","OneHanded","","2","3","0","0","0.000000","1.000000","2.010000","35.000000","250.000000","124","155","0","0","0","0","0","0","1","33","180.000000","1.000000","0.000000","0.000000","0.000000","3","0.045000","0","0","0","0","Steel","30","60","0","/Game/Items/Weapons/Axe/SM_1h_axe_cimmerian_battleaxe_ornamented_steel.SM_1h_axe_cimmerian_battleaxe_ornamented_steel","None","/Game/Items/Weapons/Axe/SM_1h_axe_cimmerian_battleaxe_ornamented_steel_DM.SM_1h_axe_cimmerian_battleaxe_ornamented_steel_DM","0","0","0","0.000000","0","385.000000","0","0","1","11502","15","1","0","0","1","0","0","0","NSLOCTEXT("""", ""9520B1ED4F7A5DC851F96E819772D4B9"", ""High Grade"")","NSLOCTEXT("""", ""51D8417C48AC52898A3D459A20FDBC57"", ""Weapon"")","","","0","0","0.000000","1","0","None","-1"
